{
  "provider": "deep_vellum_official_store",
  "retrieved_at": "2026-06-12T00:00:00Z",
  "license_note": "Official public publisher/store metadata; curated factual and approved public prose metadata only; cover display cached locally from explicit dataset URLs with attribution and takedown controls.",
  "records": [
    {
      "source_uri": "https://store.deepvellum.org/products/immigrant",
      "source_product_id": "9249163935993",
      "source_sku": "9781646054541",
      "publisher": "Deep Vellum",
      "imprint": null,
      "work": {
        "title": "Immigrant",
        "subtitle": null,
        "original_title": null,
        "publication_state": "published"
      },
      "edition": {
        "title": "Immigrant",
        "subtitle": null,
        "format": "paperback",
        "published_on": "2027-02-16",
        "isbn_13": "9781646054541"
      },
      "contributors": [
        {
          "name": "Joaquín Zihuatanejo",
          "role": "author"
        },
        {
          "name": "David Bowles",
          "role": "translator"
        }
      ],
      "cover": {
        "source_url": "https://cdn.shopify.com/s/files/1/0433/1651/0883/files/9781646054541_FC.jpg?v=1781276294",
        "provider": "deep_vellum_official_store",
        "rights_basis": "local_cache_permitted",
        "attribution_text": "Cover via Deep Vellum official source",
        "attribution_url": "https://store.deepvellum.org/products/immigrant",
        "cache_policy": "cache_allowed"
      },
      "displayed_fields": [
        "title",
        "contributors",
        "publisher",
        "format",
        "published_on",
        "isbn_13",
        "cover",
        "description",
        "storefront_url"
      ],
      "curation": {
        "status": "approved",
        "notes": "Manual source review completed. No jacket copy imported. Prose snippet curated from Deep Vellum official product page."
      },
      "description": "In a trilingual collection—presented in Nahuatl, Spanish, and English—Joaquín Zihuatenejo unflinchingly captures the duality of immigrant experiences in the United States.",
      "storefront_url": "https://store.deepvellum.org/products/immigrant"
    },
    {
      "source_uri": "https://store.deepvellum.org/products/immigrant",
      "source_product_id": "9249163935993",
      "source_sku": "9781646054558",
      "publisher": "Deep Vellum",
      "imprint": null,
      "work": {
        "title": "Immigrant",
        "subtitle": null,
        "original_title": null,
        "publication_state": "published"
      },
      "edition": {
        "title": "Immigrant",
        "subtitle": null,
        "format": "ebook",
        "published_on": "2027-02-16",
        "isbn_13": "9781646054558"
      },
      "contributors": [
        {
          "name": "Joaquín Zihuatanejo",
          "role": "author"
        },
        {
          "name": "David Bowles",
          "role": "translator"
        }
      ],
      "cover": {
        "source_url": "https://cdn.shopify.com/s/files/1/0433/1651/0883/files/9781646054541_FC.jpg?v=1781276294",
        "provider": "deep_vellum_official_store",
        "rights_basis": "local_cache_permitted",
        "attribution_text": "Cover via Deep Vellum official source",
        "attribution_url": "https://store.deepvellum.org/products/immigrant",
        "cache_policy": "cache_allowed"
      },
      "displayed_fields": [
        "title",
        "contributors",
        "publisher",
        "format",
        "published_on",
        "isbn_13",
        "cover",
        "description",
        "storefront_url"
      ],
      "curation": {
        "status": "approved",
        "notes": "Manual source review completed. No jacket copy imported. Prose snippet curated from Deep Vellum official product page."
      },
      "description": "In a trilingual collection—presented in Nahuatl, Spanish, and English—Joaquín Zihuatenejo unflinchingly captures the duality of immigrant experiences in the United States.",
      "storefront_url": "https://store.deepvellum.org/products/immigrant"
    },
    {
      "source_uri": "https://store.deepvellum.org/products/the-robert-poems",
      "source_product_id": "9248550453497",
      "source_sku": "9781646054503",
      "publisher": "Deep Vellum",
      "imprint": null,
      "work": {
        "title": "The Robert Poems",
        "subtitle": null,
        "original_title": null,
        "publication_state": "published"
      },
      "edition": {
        "title": "The Robert Poems",
        "subtitle": null,
        "format": "paperback",
        "published_on": "2026-11-17",
        "isbn_13": "9781646054503"
      },
      "contributors": [
        {
          "name": "S. Yarberry",
          "role": "author"
        }
      ],
      "cover": {
        "source_url": "https://cdn.shopify.com/s/files/1/0433/1651/0883/files/9781646054503_FC.jpg?v=1777385151",
        "provider": "deep_vellum_official_store",
        "rights_basis": "local_cache_permitted",
        "attribution_text": "Cover via Deep Vellum official source",
        "attribution_url": "https://store.deepvellum.org/products/the-robert-poems",
        "cache_policy": "cache_allowed"
      },
      "displayed_fields": [
        "title",
        "contributors",
        "publisher",
        "format",
        "published_on",
        "isbn_13",
        "cover"
      ],
      "curation": {
        "status": "approved",
        "notes": "Manual source review completed. No jacket copy imported."
      }
    },
    {
      "source_uri": "https://store.deepvellum.org/products/the-robert-poems",
      "source_product_id": "9248550453497",
      "source_sku": "9781646054510",
      "publisher": "Deep Vellum",
      "imprint": null,
      "work": {
        "title": "The Robert Poems",
        "subtitle": null,
        "original_title": null,
        "publication_state": "published"
      },
      "edition": {
        "title": "The Robert Poems",
        "subtitle": null,
        "format": "ebook",
        "published_on": "2026-11-17",
        "isbn_13": "9781646054510"
      },
      "contributors": [
        {
          "name": "S. Yarberry",
          "role": "author"
        }
      ],
      "cover": {
        "source_url": "https://cdn.shopify.com/s/files/1/0433/1651/0883/files/9781646054503_FC.jpg?v=1777385151",
        "provider": "deep_vellum_official_store",
        "rights_basis": "local_cache_permitted",
        "attribution_text": "Cover via Deep Vellum official source",
        "attribution_url": "https://store.deepvellum.org/products/the-robert-poems",
        "cache_policy": "cache_allowed"
      },
      "displayed_fields": [
        "title",
        "contributors",
        "publisher",
        "format",
        "published_on",
        "isbn_13",
        "cover"
      ],
      "curation": {
        "status": "approved",
        "notes": "Manual source review completed. No jacket copy imported."
      }
    },
    {
      "source_uri": "https://store.deepvellum.org/products/the-river-of-blessings",
      "source_product_id": "9190699008249",
      "source_sku": "9781646054626",
      "publisher": "Deep Vellum",
      "imprint": null,
      "work": {
        "title": "The River of Blessings",
        "subtitle": null,
        "original_title": null,
        "publication_state": "published"
      },
      "edition": {
        "title": "The River of Blessings",
        "subtitle": null,
        "format": "hardcover",
        "published_on": "2026-09-15",
        "isbn_13": "9781646054626"
      },
      "contributors": [
        {
          "name": "David Marquis",
          "role": "author"
        }
      ],
      "cover": {
        "source_url": "https://cdn.shopify.com/s/files/1/0433/1651/0883/files/9781646054626_FC.jpg?v=1780934017",
        "provider": "deep_vellum_official_store",
        "rights_basis": "local_cache_permitted",
        "attribution_text": "Cover via Deep Vellum official source",
        "attribution_url": "https://store.deepvellum.org/products/the-river-of-blessings",
        "cache_policy": "cache_allowed"
      },
      "displayed_fields": [
        "title",
        "contributors",
        "publisher",
        "format",
        "published_on",
        "isbn_13",
        "cover"
      ],
      "curation": {
        "status": "approved",
        "notes": "Manual source review completed. No jacket copy imported."
      }
    },
    {
      "source_uri": "https://store.deepvellum.org/products/the-river-of-blessings",
      "source_product_id": "9190699008249",
      "source_sku": "9781646054633",
      "publisher": "Deep Vellum",
      "imprint": null,
      "work": {
        "title": "The River of Blessings",
        "subtitle": null,
        "original_title": null,
        "publication_state": "published"
      },
      "edition": {
        "title": "The River of Blessings",
        "subtitle": null,
        "format": "ebook",
        "published_on": "2026-09-15",
        "isbn_13": "9781646054633"
      },
      "contributors": [
        {
          "name": "David Marquis",
          "role": "author"
        }
      ],
      "cover": {
        "source_url": "https://cdn.shopify.com/s/files/1/0433/1651/0883/files/9781646054626_FC.jpg?v=1780934017",
        "provider": "deep_vellum_official_store",
        "rights_basis": "local_cache_permitted",
        "attribution_text": "Cover via Deep Vellum official source",
        "attribution_url": "https://store.deepvellum.org/products/the-river-of-blessings",
        "cache_policy": "cache_allowed"
      },
      "displayed_fields": [
        "title",
        "contributors",
        "publisher",
        "format",
        "published_on",
        "isbn_13",
        "cover"
      ],
      "curation": {
        "status": "approved",
        "notes": "Manual source review completed. No jacket copy imported."
      }
    },
    {
      "source_uri": "https://store.deepvellum.org/products/theodoros",